,Product_Image,Product_Name,Product_Price,Product_Buy_Link
0,https://cf.shopee.com.my/file/4592ffbd4be602bce0eea5a9761c5fde_tn, Super stretchable skinny fit jeans for woman ,RM18.50 ,https://shopee.com.my/🔥🔥🔥-Super-stretchable-skinny-fit-jeans-for-woman-🔥🔥-i.265343863.4159959274?sp_atk=548d0c92-122a-4dc8-92ff-8523bb83dc09
1,https://cf.shopee.com.my/file/ed2ba52fc62c522053a46f29824f07a3_tn,Korean Style Womens Extra Elastic Highwaist Jeans Light Blue Dark Blue  Black,RM18.08 - RM19.70,https://shopee.com.my/Korean-Style-Women’s-Extra-Elastic-Highwaist-Jeans-Light-Blue-Dark-Blue-Black-i.220427661.5657810391?sp_atk=a54757bd-7e1a-4154-acde-53add7add1d4
2,https://cf.shopee.com.my/file/88790cc946f675c36fe06949757a66fb_tn,Summer Retro Loose Wide Leg Pants Women's Korean Fashion Casual High Waist Jeans Plus Size,RM23.80 ,https://shopee.com.my/Summer-Retro-Loose-Wide-Leg-Pants-Women's-Korean-Fashion-Casual-High-Waist-Jeans-Plus-Size-i.313811878.8277143219?sp_atk=9303e239-88bb-406d-b38b-72c25e4c6ad2
3,https://cf.shopee.com.my/file/7f14aa8e2a83cd1b3c8acf5c8118581a_tn,Women's Bootcut Jeans pant For women Good quality Ready Stock Size 26-36,RM19.50 ,https://shopee.com.my/Women's-Bootcut-Jeans-pant-For-women-Good-quality-Ready-Stock-Size-26-36-i.268197831.9405978343?sp_atk=e1cda3b7-2636-405b-a82b-78ce45418389
4,https://cf.shopee.com.my/file/b061e3c94434bc9a846127cf0aca642a_tn,Jean's Palazo Female Baru Loose Wide Leg Jeans Women Waist Casual High Street Ladies Denim Palazo Pants Seluar Jean,RM18.15 - RM18.99,https://shopee.com.my/Jean's-Palazo-Female-Baru-Loose-Wide-Leg-Jeans-Women-Waist-Casual-High-Street-Ladies-Denim-Palazo-Pants-Seluar-Jean-i.268197831.5935731716?sp_atk=bbe53c09-7a5e-47e2-9ffc-0ef73f93a2cf
5,https://cf.shopee.com.my/file/66301678cb1611a2491384223e7155b5_tn,Daduhey. Wide Leg Pants Jeans Women's New Loose High Waist Drape Mopping Pants,RM25.42 - RM29.44,https://shopee.com.my/💕Daduhey.-Wide-Leg-Pants-Jeans-Women's-New-Loose-High-Waist-Drape-Mopping-Pants-i.198867193.7625696621?sp_atk=c075ad01-d215-4565-a124-d2a50111d859
6,https://cf.shopee.com.my/file/8e19d85aeacfd6ac5f75fa5ad8c82806_tn,Daduhey White Wide-Leg Jeans Women's Korean-Style Loose High-Waist Mopping Pants (Fast PosFree Belt),RM22.85 - RM28.99,https://shopee.com.my/Daduhey💕-White-Wide-Leg-Jeans-Women's-Korean-Style-Loose-High-Waist-Mopping-Pants-(Fast-Pos🚀Free-Belt)-i.198867193.4036459575?sp_atk=6b4d5e13-eeb7-4d5e-8ade-9760b2337059
7,https://cf.shopee.com.my/file/2888f87fdcdaa0c84c685895a94dd384_tn,MILULU  Wide Leg Pants Jeans Women's  Loose High Waist Drape Mopping Pants S-4xl  Seluar Perempuan Local Delivery,RM9.90 - RM27.40,https://shopee.com.my/MILULU-Wide-Leg-Pants-Jeans-Women's-Loose-High-Waist-Drape-Mopping-Pants-S-4xl-Seluar-Perempuan-Local-Delivery-i.389614842.11572828120?sp_atk=051ca43f-b8d2-4b99-b115-205c02a5f7dd
8,https://cf.shopee.com.my/file/8d68421f9b445a65293c36b41cdc8892_tn,(READY STOCK)  PLUS SIZE JAGGING DANIM SKINNY JEANS,RM28.90 ,https://shopee.com.my/(READY-STOCK)-PLUS-SIZE-JAGGING-DANIM-SKINNY-JEANS-i.19942196.5515953890?sp_atk=5a30ab77-796b-402d-9975-b9f6ecb16f20
9,https://cf.shopee.com.my/file/bbf0fb5918139f3820272f88c73ab868_tn,PNT06 PandaShop Men Slim Fit Skinny Denim Jeans,RM16.49 - RM23.19,https://shopee.com.my/PNT06-PandaShop-Men-Slim-Fit-Skinny-Denim-Jeans-i.4636052.8234277959?sp_atk=9428362b-08ce-4f41-bd29-b5c7e3c0d7c8
10,https://cf.shopee.com.my/file/404ad69bcb3278dfd02a1b5e95d395e0_tn,DaDuHey High Waist Jeans Retro Wide Leg Jeans Pants Korean New Loose Drooping Slim Straight Jeans Pants,RM22.99 - RM28.99,https://shopee.com.my/DaDuHey💕-High-Waist-Jeans-Retro-Wide-Leg-Jeans-Pants-Korean-New-Loose-Drooping-Slim-Straight-Jeans-Pants-i.198867193.14306957292?sp_atk=8341270c-5104-46d5-b241-d73690db8616
11,https://cf.shopee.com.my/file/0551fcb653a7fef12d3275831b6364bc_tn,Ready Stock Jeans Korean Style Women High Waist Harem Skinny Loose Denim Long Pants celana wanita,RM27.60 - RM28.00,https://shopee.com.my/Ready-Stock-Jeans-Korean-Style-Women-High-Waist-Harem-Skinny-Loose-Denim-Long-Pants-celana-wanita-i.41415942.3933286065?sp_atk=b5248c80-b5aa-42ba-bdc5-3b51cd9cd4af
12,https://cf.shopee.com.my/file/64fcb59bcc3109c8df342150e54685f5_tn,ZANZEN Korean Style Women's washed love jeans Korean straight-leg pantswide leg pantshigh-waisted trousers,RM30.05 ,https://shopee.com.my/ZANZEN-Korean-Style-Women's-washed-love-jeans-Korean-straight-leg-pantswide-leg-pantshigh-waisted-trousers-i.420521432.10512561822?sp_atk=0cf93a54-9be3-442e-a89b-fd0f95b06fec
13,https://cf.shopee.com.my/file/10731cbba1e77ca6d0177cee4b7e87f7_tn,MCO SALES Uniqlo Jeans Slimfit Dark Blue,RM45.00 - RM50.00,https://shopee.com.my/⭕MCO-SALES⭕-Uniqlo-Jeans-Slimfit-Dark-Blue-i.91213.824688878?sp_atk=a1c6e0e9-a81e-4224-b1fa-8f7619826821
14,https://cf.shopee.com.my/file/49a4dede394b82c71dfb0aaadefdae7a_tn,MOLLGE Seluar Jeans Lelaki Slim Fit Jeans Men Straight Cut Jeans Seluar Panjang Denim White Jeans Man Pants Pendek Shorts,RM24.91 ,https://shopee.com.my/💥MOLLGE💥-Seluar-Jeans-Lelaki-Slim-Fit-Jeans-Men-Straight-Cut-Jeans-Seluar-Panjang-Denim-White-Jeans-Man-Pants-Pendek-Shorts-i.368455815.7690157273?sp_atk=b3407bb1-5257-47ee-955f-24bded40ada1
15,https://cf.shopee.com.my/file/d2bf966fcf2b98d276b0dfad094f0c22_tn,Women Jeans Denim palazo Baggy Straight Cut Pants Highwaist Seluar crop jeans woman Loose(ready stock),RM21.75 - RM21.83,https://shopee.com.my/Women-Jeans-Denim-palazo-Baggy-Straight-Cut-Pants-Highwaist-Seluar-crop-jeans-woman-Loose(ready-stock)-i.450300061.8059442488?sp_atk=ae51432a-8421-4b85-bdcd-3287ea497c2d
16,https://cf.shopee.com.my/file/18e79639f73bd2ba8b1414942e669680_tn,Skinny super stretchable jeans women seluar perempuan (available stock),RM16.54 - RM19.09,https://shopee.com.my/🔥Skinny-super-stretchable-jeans-women-seluar-perempuan-🔥(available-stock)-i.311293851.6576456400?sp_atk=94293104-7756-4839-a91f-44ca841f7aae
17,https://cf.shopee.com.my/file/c1e629a45a7cbbc5cd8c9f9afa921e36_tn,Cheap jeans men casual jeans seluar koyak Seluar Four Seasons Seluar Jeans Lutut Seluar Lelaki Gaya Korea Ramping Bergaya Seluar Bergaris Seluar Goresan Seluar Pengemis Hitam skinny jeans long pants Men's  pants with holes in jeans Small tube  ,RM24.77 ,https://shopee.com.my/Cheap-jeans-men-casual-jeans-seluar-koyak-Seluar-Four-Seasons-Seluar-Jeans-Lutut-Seluar-Lelaki-Gaya-Korea-Ramping-Bergaya-Seluar-Bergaris-Seluar-Goresan-Seluar-Pengemis-Hitam-skinny-jeans-long-pants-Men's-pants-with-holes-in-jeans-Small-tube-夏季男士黑色破洞-牛仔裤-i.534539975.13507224903?sp_atk=4b5ebb04-dc45-4e21-a0de-c0325cf1220f
18,https://cf.shopee.com.my/file/b0d7efa1bccaadf47aa1c55586e549c0_tn,Ready Stock women's Water washed Korean love hearts jeans straight-leg pantswide High Waist Wide Pants Leisure trousers,RM30.00 ,https://shopee.com.my/Ready-Stock-women's-Water-washed-Korean-love-hearts-jeans-straight-leg-pantswide-High-Waist-Wide-Pants-Leisure-trousers-i.420519917.10609818882?sp_atk=a24397ca-982e-4712-a22c-6d601b67103f
19,https://cf.shopee.com.my/file/97685516cd405eba3f8ab8271fa5d11d_tn,New Korean Embroidered Jeans Women's High Waist Casual Pants Loose Joker,RM29.98 - RM41.35,https://shopee.com.my/New-Korean-Embroidered-Jeans-Women's-High-Waist-Casual-Pants-Loose-Joker-i.301145915.7878951169?sp_atk=f6f2ae65-b3d8-479f-8e08-fc278b679b1a
20,https://cf.shopee.com.my/file/1ff59c5066785313591d5d343390d08b_tn,MOLLGESummer Breathable White Jeans Men Straight leg Pants Casual Pants,RM28.91 ,https://shopee.com.my/💥MOLLGE💥Summer-Breathable-White-Jeans-Men-Straight-leg-Pants-Casual-Pants-i.368455815.8171470041?sp_atk=62067c07-ffcb-40ff-8d25-5db5499d72dc
21,https://cf.shopee.com.my/file/3641eeef73f153fa81f63bf2b84b9c37_tn," woman BOOT CUT JEANS  size 26""38  STREACHABLE DANIM high quality",RM23.23 - RM29.98,https://shopee.com.my/💥💥-woman-BOOT-CUT-JEANS-size-26-38-STREACHABLE-DANIM-high-quality-i.385748553.10601264237?sp_atk=1c25031d-5928-4870-86b7-f2e67123d449
22,https://cf.shopee.com.my/file/4cd6f0ccff1d28ca6a1805ce7710a319_tn,Korean Style Womens HighWaist Strechable Denim Jeans  Local Seller Fast Delivery ,RM19.05 ,https://shopee.com.my/Korean-Style-Women’s-HighWaist-Strechable-Denim-Jeans-👖-Local-Seller-Fast-Delivery-🚚-i.220427661.11722654041?sp_atk=0b09bda6-91a7-4ed2-a14f-c668d5134fda
23,https://cf.shopee.com.my/file/7abf0860d697c9d8291d226fedff2f1e_tn,J&M Ready Stock Jeans Women Shorts Ripped Jeans High Waist A-Line Summer Black Blue Jeansains,RM26.09 ,https://shopee.com.my/J-M️️❤️-Ready-Stock-Jeans-Women-Shorts-Ripped-Jeans-High-Waist-A-Line-Summer-Black-Blue-Jeans黑色破洞牛仔短裤高腰短裤牛仔a字阔腿热裤潮ins-i.220411848.9847634541?sp_atk=c32a9d84-045b-4a8b-9bc6-9dce13c39ce6
24,https://cf.shopee.com.my/file/9628746a876a403dd4c499fd83045809_tn,LEE COOPER Mens Corduroy Mid-Rise Stretchable Jeans (LC-10),RM169.90 ,https://shopee.com.my/LEE-COOPER-Mens-Corduroy-Mid-Rise-Stretchable-Jeans-(LC-10)-i.42849511.5619864196?sp_atk=00fea644-7aae-4125-9763-2cccf2cda32c
25,https://cf.shopee.com.my/file/355c0dcd92bc774cea96f8332114785b_tn,Blue Denim Love Embroidery Wide Leg Jeans Women Loose Casual Korean Jeans Trousers High Waist Plus Size Jeans Pants Straight,RM34.50 ,https://shopee.com.my/Blue-Denim-Love-Embroidery-Wide-Leg-Jeans-Women-Loose-Casual-Korean-Jeans-Trousers-High-Waist-Plus-Size-Jeans-Pants-Straight-i.139104689.9522359595?sp_atk=7d24fe22-3512-4ff5-bad1-b2018f673df1
26,https://cf.shopee.com.my/file/ae57b14fbc28b817eb9644738ac18946_tn,Plus Size jegging women streachable jeans & seluar wanita denim memeri besar,RM24.49 - RM31.35,https://shopee.com.my/Plus-Size-jegging-women-streachable-jeans-seluar-wanita-denim-memeri-besar-i.136189346.7658145169?sp_atk=71821383-2cbe-407d-b46e-f53cb93e96a4
27,https://cf.shopee.com.my/file/a034be0555f28d4b2776761bd4d73471_tn,Ready Stock! High Waist Jeans Women Elastic Denim Jeans Trousers Plus Size Jean Pants Casual Loose Korean Black White Apricot,RM34.00 ,https://shopee.com.my/Ready-Stock!-High-Waist-Jeans-Women-Elastic-Denim-Jeans-Trousers-Plus-Size-Jean-Pants-Casual-Loose-Korean-Black-White-Apricot-i.139104689.5783031810?sp_atk=b05b9130-3cf2-4cb7-b786-27b6f2608676
28,https://cf.shopee.com.my/file/99036a7bc967b4bbc60908e685a86ae7_tn,READY STOCKST175 Jeans Women Loose Korean High Waist Wide Leg Straight Student Elastic Waist Harem Pants,RM22.30 ,https://shopee.com.my/【READY-STOCK】ST175-Jeans-Women-Loose-Korean-High-Waist-Wide-Leg-Straight-Student-Elastic-Waist-Harem-Pants-i.230700731.4641792274?sp_atk=201a6ae8-56f1-4a6a-bca4-4a1b8d224d5f
29,https://cf.shopee.com.my/file/8f2238a84a21df23d6579f5f9eafadfb_tn,Women Loose Casual Straight Korean Jeans Fashion Retro High Waist Slim Long Pants Jeans Denim Seluar,RM25.00 ,https://shopee.com.my/Women-Loose-Casual-Straight-Korean-Jeans-Fashion-Retro-High-Waist-Slim-Long-Pants-Jeans-Denim-Seluar-i.41415942.7932766553?sp_atk=49ca57d1-fb8d-415b-bc6a-9e9890b0571b
30,https://cf.shopee.com.my/file/fcbbeb0f4bb0066f983b3cec2a822415_tn,READY STOCK SKINNY KOYAK BERGETAH Meletop murah jimat |  Men Denim Summer Jeans Long Pants Pant Seluar Jean Seluar,RM45.00 ,https://shopee.com.my/READY-STOCK-SKINNY-KOYAK-BERGETAH-Meletop-murah-jimat-Men-Denim-Summer-Jeans-Long-Pants-Pant-Seluar-Jean-Seluar-i.46840756.2067455666?sp_atk=45b8e806-3e13-421a-918a-6c1635681a21
31,https://cf.shopee.com.my/file/3b172721bc2bbd4d2cf43d7cc8a05af0_tn,Ready Stock  Men's Stretchy Ripped Skinny Biker Jeans Damage Slim Fit Denim Long Pants Plus-Size M-5XL,RM39.69 - RM55.00,https://shopee.com.my/👉Ready-Stock🔥-Men's-Stretchy-Ripped-Skinny-Biker-Jeans-Damage-Slim-Fit-Denim-Long-Pants-Plus-Size-M-5XL-i.55661177.7019341865?sp_atk=d7fc8e57-3d3e-4731-91f8-95a13f9da4ef
32,https://cf.shopee.com.my/file/9c0df254058e6352552d1553113ae684_tn,EDWIN Brand Men Slim Fit-Regular Rise Stretchable Jeans (7706-2453/7706-2525,RM99.50 ,https://shopee.com.my/EDWIN-Brand-Men-Slim-Fit-Regular-Rise-Stretchable-Jeans-(7706-2453-7706-2525）-i.42849511.1655258386?sp_atk=3376064e-1023-43b3-b74e-ec923e958a44
33,https://cf.shopee.com.my/file/470251bd37f86d90df7a4cac42c1bd7d_tn,ZUCCA CASUAL COMFY (S-3XL) WOMEN JEANS PALAZZO PANTS - J002,RM18.90 ,https://shopee.com.my/ZUCCA-CASUAL-COMFY-(S-3XL)-WOMEN-JEANS-PALAZZO-PANTS-J002-i.38117712.9818296401?sp_atk=1b33b60b-fd1f-42cc-b392-2c3a2c211e35
34,https://cf.shopee.com.my/file/796d377feab2c24344271d179ffc9616_tn,DaDuHey 6 Colors Loose Wide Leg Jeans Women High Waist Casual High Street Ladies Denim Jeans Pants(Free Belt),RM23.00 - RM29.00,https://shopee.com.my/DaDuHey💕-6-Colors-Loose-Wide-Leg-Jeans-Women-High-Waist-Casual-High-Street-Ladies-Denim-Jeans-Pants(Free-Belt)-i.198867193.13564543710?sp_atk=465fcd79-a4ee-43b4-b143-31b29133378c
35,https://cf.shopee.com.my/file/a3650bc7707708a9b24e783e8a501dec_tn,Women Denim straight cut  jeans / Stractable jeans black/dark blue/Light blue/blue Ready stock,RM18.69 ,https://shopee.com.my/🔥Women-Denim-straight-cut-jeans-Stractable-jeans-black-dark-blue-Light-blue-blue-Ready-stock🔥-i.413016685.6884246425?sp_atk=13b22dc0-8efe-4177-8796-e14ca1b8b935
36,https://cf.shopee.com.my/file/f4605aa595640749d5dae332fe87a032_tn,Korean style High waist Harem Jeans Women Slim fit Denim Jogger Pants Fashion Sport Ankle cut Loose Straight Long Casual Trousers White Black Blue seluar perempuan slack pinggang getah sukan remaja panjang celana wanita jin murah putih hitam,RM25.91 - RM35.96,https://shopee.com.my/Korean-style-High-waist-Harem-Jeans-Women-Slim-fit-Denim-Jogger-Pants-Fashion-Sport-Ankle-cut-Loose-Straight-Long-Casual-Trousers-White-Black-Blue-seluar-perempuan-slack-pinggang-getah-sukan-remaja-panjang-celana-wanita-jin-murah-putih-hitam-i.477826598.11235704000?sp_atk=2bcfbbd6-e860-4adb-a622-94821194bf5e
37,https://cf.shopee.com.my/file/7eac3b1fabe0a78ceb2aa58386e3b6a7_tn,Butterfly Printed Jeans personalized print jeans high waist slim  loose all-match black straight mopping pants,RM28.88 - RM35.88,https://shopee.com.my/🦋Butterfly-Printed-Jeans-🦋personalized-print-jeans-high-waist-slim-loose-all-match-black-straight-mopping-pants-i.276033108.6679777433?sp_atk=d23654fc-5f94-4099-bcef-580eaa98b59c
38,https://cf.shopee.com.my/file/a3c53b2455200aabd4321250def452e9_tn,Size 25~40Jeans Pants Women's High Waist Elastic Stretch Tight-fitting Solid Color Slim Long Jeans Pants,RM21.96 - RM26.96,https://shopee.com.my/【Size-25~40】Jeans-Pants✨-Women's-High-Waist-Elastic-Stretch-Tight-fitting-Solid-Color-Slim-Long-Jeans-Pants-i.198867193.4344244372?sp_atk=93e7c3dc-768a-440e-9c95-d593c80b516f
39,https://cf.shopee.com.my/file/3160b62ca8db403baaf0bee21453c5fc_tn,ANANA-Women Wide Leg Flare Jeans High Waist Solid Color Loose Denim Pants with Pockets,RM41.30 ,https://shopee.com.my/ANANA-Women-Wide-Leg-Flare-Jeans-High-Waist-Solid-Color-Loose-Denim-Pants-with-Pockets-i.161268915.8975765840?sp_atk=3fcf9c4a-d833-4274-9dee-d3630220fa1d
40,https://cf.shopee.com.my/file/da26f9194258dab2d72690221f55cfb4_tn,Split Flare Jeans Trousers Women Plus Size Denim Pants Jeans Woman High Waist Casual Loose Jeans Taille Haute Black Blue Korean Jeans,RM44.00 ,https://shopee.com.my/Split-Flare-Jeans-Trousers-Women-Plus-Size-Denim-Pants-Jeans-Woman-High-Waist-Casual-Loose-Jeans-Taille-Haute-Black-Blue-Korean-Jeans-i.139104689.8121880143?sp_atk=e4a64bf4-c697-46ee-b50b-e20a16a9cd96
41,https://cf.shopee.com.my/file/f6cf21929fc862f5ebe52003510451cf_tn,[BIG SIZE ] Womans skinny jeans Plus Size kain getah Supper Skinny Good Quality,RM18.26 - RM28.80,https://shopee.com.my/-BIG-SIZE-Woman’s-skinny-jeans-Plus-Size-kain-getah-Supper-Skinny-Good-Quality-i.210093258.8122131309?sp_atk=b9068961-c89e-4093-bf41-c39572655ac6
42,https://cf.shopee.com.my/file/1a268e797c2174556d9518b877af699e_tn,Lovito Wide Leg Slit Tencel Jean L02154 (Blue),RM31.49 ,https://shopee.com.my/Lovito-Wide-Leg-Slit-Tencel-Jean-L02154-(Blue)-i.445279067.6793600855?sp_atk=96068410-a323-47e3-a761-1de3db37294d
43,https://cf.shopee.com.my/file/fc7ae73cb2b6f0bad5f612d416237fc5_tn,[READY STOCKS] Skinny/Slim Fit Jeans Pants For Men & unisex material Stretchable (26-36),RM19.99 - RM29.99,https://shopee.com.my/🇲🇾-READY-STOCKS-Skinny-Slim-Fit-Jeans-Pants-For-Men-unisex-material-Stretchable-(26”-36”)-i.210093258.9139571838?sp_atk=9f4db8ae-1ee1-46fc-9014-fa2231bcf0d6
44,https://cf.shopee.com.my/file/e33385f26c2822c13602d1625bbc4ef4_tn,Ready stock fashion new Hole tattered jeans slim straight casual spring summer men Denim beggar pants,RM30.69 ,https://shopee.com.my/Ready-stock-fashion-new-Hole-tattered-jeans-slim-straight-casual-spring-summer-men-Denim-beggar-pants-i.162253743.2519975987?sp_atk=fd2de0cf-b4c0-4d64-903c-aa5bdfc9ff9a
45,https://cf.shopee.com.my/file/a5e3a8caf5be575cce46734eebd4b53b_tn,DaDu Cropped Jeans Women's Loose Korean Slim High Waist Cropped Skinny Pants Women's All-Matching Straight Pants,RM25.85 - RM28.85,https://shopee.com.my/DaDu💖-Cropped-Jeans-Women's-Loose-Korean-Slim-High-Waist-Cropped-Skinny-Pants-Women's-All-Matching-Straight-Pants-i.198867193.4463313159?sp_atk=fb34f754-e1ab-4603-bfd2-31618028da64
46,https://cf.shopee.com.my/file/6673c328e7df04517e2bbf769aefc057_tn,Tattered jeans men's spring and summer trend men's slim little feet light nine point pants men,RM33.00 - RM35.00,https://shopee.com.my/Tattered-jeans-men's-spring-and-summer-trend-men's-slim-little-feet-light-nine-point-pants-men-i.39125792.7934498467?sp_atk=bcd5bd34-02f0-41aa-a826-d24f064c7fed
47,https://cf.shopee.com.my/file/ab1860b36697f13b32fc83f7f2473098_tn,[DS2U]   NEW STOCK  Maternity Jeans Slim Fit | Seluar Jeans Mengandung Slim Cut,RM39.99 ,https://shopee.com.my/-DS2U-🇲🇾-❤️-NEW-STOCK-❤️-Maternity-Jeans-Slim-Fit-Seluar-Jeans-Mengandung-Slim-Cut-i.11832435.2448648453?sp_atk=5ed0add2-e2d6-4cdd-a874-0cdd27bd1642
48,https://cf.shopee.com.my/file/93bfa0b4b9145a392456984fa4473a31_tn,40-56 MAN LELAKI BIG SIZE LONG JEANS COLOUR BIRU PLUS SIZE LIMITED TIME OFFER,RM39.90 - RM50.00,https://shopee.com.my/40-56-MAN-LELAKI-BIG-SIZE-LONG-JEANS-COLOUR-BIRU-PLUS-SIZE-LIMITED-TIME-OFFER-i.35148603.2666896586?sp_atk=c8f98514-7446-464c-9380-6014bc80d1b7
49,https://cf.shopee.com.my/file/d8746781028db4cf630151a1383f794d_tn,Men Men's Jeans Moto Black Denim Jeans Pants Slim Distressed Ripped Skinny Fit Jeans Skinny Jeans Straight Jeans,RM19.80 - RM35.64,https://shopee.com.my/Men-Men's-Jeans-Moto-Black-Denim-Jeans-Pants-Slim-Distressed-Ripped-Skinny-Fit-Jeans-Skinny-Jeans-Straight-Jeans-i.131353251.1995239908?sp_atk=cf920565-fe69-4ab7-bd54-cc7fdb01e602
50,https://cf.shopee.com.my/file/e15e59bed3dccfc4e78f317c8c4b6dbf_tn,"GD-Women Straight Wide Leg Jeans, Trendy Stitching High Waist Relaxed Fit Denim Pants with Pockets",RM49.19 ,https://shopee.com.my/GD-Women-Straight-Wide-Leg-Jeans-Trendy-Stitching-High-Waist-Relaxed-Fit-Denim-Pants-with-Pockets-i.161268915.9704821227?sp_atk=f5f144a4-3a19-4855-885c-cb352ffe0d9a
51,https://cf.shopee.com.my/file/b99f2cf87b3d816d5a7a2f9fdf1ff700_tn,Benang Jeans Dolphin 200m / Batch 1,RM2.30 ,https://shopee.com.my/Benang-Jeans-Dolphin-200m-Batch-1-i.7330449.1331450854?sp_atk=5bc88cc0-16aa-4141-94e4-372ab2387652
52,https://cf.shopee.com.my/file/6ef5f867804e4ca35026e845b23d8267_tn,Barca 01 Men's Denim Jeans - Bottom Man Long Pants Edwin Jeans,RM84.08 - RM89.90,https://shopee.com.my/Barca-01-Men's-Denim-Jeans-Bottom-Man-Long-Pants-Edwin-Jeans-i.240866410.5724763184?sp_atk=4a5ed6e4-5fa7-4b53-a456-c60d8dfd5c18
53,https://cf.shopee.com.my/file/1a7c6ef50f52602d0bb1f34546f9e3e7_tn,Min Strap Style Bodycon Short Jeans Pants Elastic High Waist Jeans Short Pants Women Seluar Pendek Perempuan ,RM31.99 - RM48.90,https://shopee.com.my/Min-Strap-Style-Bodycon-Short-Jeans-Pants-Elastic-High-Waist-Jeans-Short-Pants-Women-Seluar-Pendek-Perempuan-高腰短褲女休閒牛仔短褲-i.224074353.12325371339?sp_atk=c0bc70c1-30df-4518-bd28-43a5635129e0
54,https://cf.shopee.com.my/file/66b6644910a7d1403690e5270db56b4e_tn,Ready stockWomen's Blue Embroidery Wide Leg Jeans Woman Loose Casual Denim Pants High Waist Straight Jeans,RM28.98 ,https://shopee.com.my/👗Ready-stock👗Women's-Blue-Embroidery-Wide-Leg-Jeans-Woman-Loose-Casual-Denim-Pants-High-Waist-Straight-Jeans-i.296135709.8077328098?sp_atk=99891b86-3521-4b90-b2ec-c194b7cd1b06
55,https://cf.shopee.com.my/file/41774eeee09805e55fbe27f8db12e1ef_tn,Womens High Quality Momfit Boyfriend Jeans High Quality Materials Fast Delivery ,RM23.77 - RM25.22,https://shopee.com.my/Women’s-High-Quality-Momfit-Boyfriend-Jeans-High-Quality-Materials-Fast-Delivery-🚚-i.220427661.10766375450?sp_atk=6cce41d4-5b10-4be9-b9c4-c4da83c46cb2
56,https://cf.shopee.com.my/file/ba1da4404cbb4719e7cbf6010c9e8dd9_tn,READY STOCKST243 Harajuku Straight Cut Jeans Women High Waist Casual High Street Ladies Denim Pants,RM24.70 ,https://shopee.com.my/【READY-STOCK】ST243-Harajuku-Straight-Cut-Jeans-Women-High-Waist-Casual-High-Street-Ladies-Denim-Pants原宿风直筒九分牛仔裤-i.230700731.3288473296?sp_atk=581b2130-3504-4ce7-9d30-a96c242e6896
57,https://cf.shopee.com.my/file/9ff21a8a135657be1419b04179cb532a_tn,Daduhey. Limit Discount Women High Waist Elastic Stretch Tight-fitting Solid Color Slim Long Jeans Pants,RM18.00 ,https://shopee.com.my/💕Daduhey.-🕒Limit-Discount🕕-Women-High-Waist-Elastic-Stretch-Tight-fitting-Solid-Color-Slim-Long-Jeans-Pants-i.198867193.3307827048?sp_atk=478a8a78-1157-4e03-84c7-9a391de49fc0
58,https://cf.shopee.com.my/file/3f8e133250f040290ee43f37afb6be74_tn,READY STOCKST176 Loose Wide Leg Jeans Women High Waist Casual High Street Ladies Denim Pants,RM23.40 ,https://shopee.com.my/【READY-STOCK】ST176-Loose-Wide-Leg-Jeans-Women-High-Waist-Casual-High-Street-Ladies-Denim-Pants-i.230700731.3241955680?sp_atk=a39a16fb-1157-438b-a6bc-c8d8e7ecf20e
59,https://cf.shopee.com.my/file/2337cb361fedc77086df9f68a52f7fbf_tn,Black & White Jeans streachable With Plus Size [Ready Stock],RM18.95 - RM42.23,https://shopee.com.my/Black-White-Jeans-streachable-With-Plus-Size-Ready-Stock--i.27653025.7310140945?sp_atk=148829c1-2dcd-4d3d-b308-8c7552e380e5